date,company,text
2022-10-25,MTN,세계바이오서밋 각국 방역수장들 한국에 모였다  한국 백신 필요한 국가 제공
2022-10-25,MTN,보건복지부와 세계보건기구WHO가 주최하는 세계바이오서밋World Bio Summit 2022이 오늘25일 오후 서울 광진구 그랜드 워커힐에서 개막했다이날 개막식에는 윤석열
2022-11-10,초이스경제,옵션만기일 코스피 급랭LG디스플레이  SK바이오  한화솔루션 선방
2022-11-10,초이스경제,초이스경제 이영란 기자 11월 옵션만기일인 10일 코스피 지수가 외국인과 기관의 매도 공세 속에 1 가까이 하락하며 2400선까지 밀려났다 최근 지수의 연일 상승에 따른 차익매물과 미국 중간선거의 예상 밖 결과 가상화폐의 시장 변동성 중국의 코로나 재확산 우려 등이 국내증시를 냉각시켰다 10일현지시간로 예정된 미국 소비자물가지수CPI 발표를 앞둔 경계감도 일부 나타났다 국내 금융시장에서 원달러 환율은 장중 1370원대로 올라갔고원화가치 약세 8거래일째 매수를 이어가던 외국인들은 이날 매도로 돌
2022-08-19,,단독 SK 베트남 이멕스팜 지분 추가 매입
2022-08-19,,더구루정예린 기자 SK그룹이 베트남 5대 제약사 이멕스팜에 달 연속 추가 투자를 단행한다 고성장이 예상되는 현지 제약 시장에서 새로운 사업 기회를 모색하는 양사 간 시너지 효과가 기대된다 19일 호찌민 증권거래소에 따르면 이멕스팜은 지난 16일현지시간 SK그룹 통남아시아 지역 투자 전담 법인인 SK인베스트먼트 전날 추가 지분
2022-11-29,비즈니스워치,FDA 허가 국산 항암 신약 전무다음 도전 주자는
2022-11-29,비즈니스워치,한미약품의 비소세포폐암 치료제 39포지오티닙39이 미국 허가에 고배를 마시면서 FDA의 높은 벽을 실감하고 아직 국내 기업이 항암제 분야에서 FDA 승인을 받은 사례는 최근 글로벌
2022-08-19,,단독 SK 베트남 이멕스팜 지분 추가 매입
2022-08-19,,더구루정예린 기자 SK그룹이 베트남 5대 제약사 이멕스팜에 달 연속 추가 투자를 단행한다 고성장이 예상되는 현지 제약 시장에서 새로운 사업 기회를 모색하는 양사 간 시너지 효과가 기대된다 19일 호찌민 증권거래소에 따르면 이멕스팜은 지난 16일현지시간 SK그룹 통남아시아 지역 투자 전담 법인인 SK인베스트먼트 전날 추가 지분
2022-11-29,비즈니스워치,FDA 허가 국산 항암 신약 전무다음 도전 주자는
2022-11-29,비즈니스워치,한미약품의 비소세포폐암 치료제 39포지오티닙39이 미국 허가에 고배를 마시면서 FDA의 높은 벽을 실감하고 아직 국내 기업이 항암제 분야에서 FDA 승인을 받은 사례는 최근 글로벌
2022-08-08,워크투데이,2분기 실적 CJ제일제당 SK케미칼 SKC 에스티팜 LIG넥스원 한국항공우주산업 원익QnC 엠로
2022-08-08,워크투데이,CJ제일제당 2분기 매출 첫 7조 돌파영업이익 5043억원국내 최대 식품기업 CJ제일제당이 올해 2분기 바이오사업과 39K푸드39 매출에 분기 기준 사상 최대 매출과 영업이익을 냈다최근 원부자재 가격 인상세 시장 부담이 커진 상황 속에서 해외 수출 판로 확대와 생산 효율화를 통해 거둔 선방이라는 평가가 따른다CJ제일제당은 연결 기준 올해 2분기 영업이익이 5043억원으로 지난해 동기보다 74 증가한 것으로 잠정 집계됐다고 8일 공시했다매출은 7조5166억원으로 작년 동기 대비 191
2022-10-13,핀포인트뉴스,투자주체 매매동향 외국인 SK하이닉스 660억원 사들여 순매수 1위
2022-10-13,핀포인트뉴스,핀포인트뉴스 한강희 기자 코스피가 40포인트 가까이 하락하며 216287까지 밀려났지만 외국인은 1900억원 가량 순매수를 기록했다 13일 한국거래소에 따르면 이날 외국인투자자들은 유가증권시장에서 SK하이닉스와 삼성전자 반도체 주식을 순매수했다 외국인투자자들은 SK하이닉스 주식을 664억원 순매수했고 삼성전자를 331억원 사들였다 LG에너지솔루션을 270억원 사들이며 순매수 상위권에 이름을 올렸다외국인투자자들의 시장별 순매수 순매도 상위종목은 다음과 같다외국인 유가증권시장 순매수 상위 종목13일S
2022-10-15,데일리한국,코로나19 1000일제약바이오 백신치료제 개발
2022-10-15,데일리한국,데일리한국 최성수 기자 15일이면 신종 코로나바이러스 감염증코로나19이 국내에 유입된 어느덧 1000일이다 코로나19는 삶의 것을 놨다 산업도 마찬가지다 코로나19는 국내 제약바이오기업들이 경쟁력을 갖췄는지 있는 계기가 됐다제약사들은 너도나도 백신치료제 개발에 뛰어들었고 실제로 개발에 성공한 사례가 나왔다 대부분의 기업들이 주가만 띄운 채 코로나19 치료제 개발 포기를 선언한 것은 제약 산업의 암으로 남았다코로나19 치료제 개발 선언과 잇따른 포기2020년 1월
,메트로신문,메트로 창간 20주년 코로나19가 키운 제약바이오 산업 국가 미래 성장동력으로 자리매김
,메트로신문,윤석열 대통령이 지난 26일 충북 청주 국립보건연구원 바이오뱅크국립중앙인체자원은행에서 권준욱 국립보건연구원장의 바이오 뱅크 현황 브리핑을 청취하고 뉴시스 코로나19가 휩쓸고 지나간 자리에 제약바이오의 전성시대가 도래했다 새 정부 들어 바이오 산업이 국책
2022-11-25,한국일보,강남 빌딩 김은혜 재산 265억 류광준 과기부 실장 131억 주식
2022-11-25,한국일보,김은혜 대통령실 홍보수석비서관이 서울 강남구 대치동 빌딩 213억9373만 상당의 부동산을 보유하고 있는 것으로 나타났다 이번에 재산을 공개한 고위공직자 가장 많다 24일 정부공직자윤리위원회가 발표한 11월 공직자 수시재산공개에 따르면 김 수석은 총 265억6649만 원을 재산으로 신고했다 김 수석이 신고한 재산 대부분은 배우자 유형동
2022-10-16,핀포인트뉴스,주간 투자주체 동향 외국인투자자 SK하이닉스한국항공우주 주간 순매수 상위권
2022-10-16,핀포인트뉴스,핀포인트뉴스 한강희 기자 16일 한국거래소에 따르면 지난 한주간 외국인투자자들은 유가증권시장에서 SK하이닉스 주식을 집중 매수한 것으로 나타났다외국인투자자들은 지난 11일부터 14일까지 SK하이닉스 주식을 635억원67만주 집중 매수하면서 순매수 1위를 기록했다뒤를 이어 한국항공우주 195억원 한화솔루션 121억원을 사들이며 순매수 상위권에 이름을 올렸다반면 지난 한주간 NAVER SKC LG화학 등은 처분했다다음은 외국인과 기관 개인투자자들의 시장별 주간 순매수 순매도 상위종목이다외국인 유가
2022-10-20,메디코파마,반환점 넘은 4분기 제약바이오 종목 담아야
2022-10-20,메디코파마,메디코파마뉴스김정일 기자 올해도 절반을 넘어 1분기 만을 남겨 놓고 연초 증시에 드리워진 먹구름이 많았던 예로부터 나쁜 기운을 물리치고 복을 가져오는 상징으로 여겨진 검은 호랑이해의 강인함을 기대했다 증시는 기대에 무색하게 속절없이 무너져 버린 성적표를 받았다실제로 지난 3분기까지 의약품 제약지수로 구성된 제약바이오 종목들의 사라진 시가총액은 41조 원에 달했고 4종목 1종목은 작년 연말 주가보다 반 토막 난 상태가 된 것으로 드러났다 코스닥 제약지수는 1115084포인트에서 683370
,데일리메디,바이오 CDMO 먹거리 부상롯데 대기업 러시
,데일리메디,제약산업에서 바이오의약품이 차지하는 비중이 날이 갈수록 높아지면서 새롭게 급부상하고 있는 사업이 바이오의약품 위탁개발생산을 뜻하는 CDMO다CDMO는 의약품 위탁생산을 뜻하는 CMO와 위탁개발을 뜻하는 CDO의 합성어다 기존의 위탁생산에서 생산을 위한 공정 개발까지 합해진 개념이다바이오신약을 개발하기 위한 과정은 복잡하고 시간이 많이 소요된다 특히 개발을 한다 생산까지 자체적으로 위해서는 생산 시설에 대한 투자도 해야 자금 여력이 없는 업체에는 부담이 될
2022-10-14,핀포인트뉴스,투자주체 매매동향 외국인투자자 SK하이닉스한국항공우주 순매수 상위권
2022-10-14,핀포인트뉴스,핀포인트뉴스 한강희 기자 14일 한국거래소에 따르면 이날 외국인투자자들은 유가증권시장에서 SK하이닉스 주식을 집중 매수한 것으로 나타났다외국인투자자들은 이날 SK하이닉스 주식을 635억원67만주 집중 매수하면서 순매수 1위를 기록했다 이날 SK하이닉스는 전일대비 063 상승 마감했다 뒤를 이어 한국항공우주 195억원 한화솔루션 121억원을 사들이며 순매수 상위권에 이름을 올렸다 이날 한국항공우주는 550 급등했고 한화솔루션은 341 상승 마감했다 반면 외국인투자자들은 유가증권시장에서 NAVER
2022-09-21,핀포인트뉴스,KRX헬스케어 시총 4350억 줄어에스티팜 373 상승 웃음
2022-09-21,핀포인트뉴스,핀포인트뉴스 한강희 기자 21일 한국거래소에 따르면 지난 20일 KRX헬스케어 지수 구성종목 시가총액은 169조4933억원을 기록해 19일 시가총액 169조9284억원과 비교해 4350억원 감소한 것으로 나타났다지수 구성 종목 에스티팜 종목은 전날 373 상승해 KRX헬스케어 지수 구성 종목 주가상승률 1위를 기록했다에스티팜 뒤를 이어 클래시스 영진약품 종목이 303 274씩 상승해 주가 상승률 상위권에 이름을 올렸다한편 SK바이오사이언스 종목은 461를 기록해 지수 구성종목 가장 부진
,팜이데일리,바이오 우선주의가 기회인 국내 바이오업체들
,팜이데일리,바이오산업에 미국 우선주의가 적용되자 일부 국내 바이오기업들이 미국 현지 생산기지 확보에 검토하고 미국 현지에 이미 생산시설을 두고 있거나 인수 중인 업체들의 인한 수혜도 예상된다앞서 조 바이든 미국 대통령은 지난달 12일현지 바
,데일리메디,표적항암 혁신신약 국가신약개발사업 과제 선정
,데일리메디,SK바이오팜대표이사 사장 조정우은 자체 개발 중인 표적항암 혁신신약 SKL27969가 국가신약개발사업 과제로 선정돼 협약을 체결했다고 14일 밝혔다신약개발 사업은 정부가 미충족 의료 수요가 높은 분야의 치료제 개발을 촉진하기 위해 제약바이오 기업 학교 연구소 병원 등의 신약개발을 독려하는 범부처 국가 RD 지원 프로그램이다이번 협약으로 SKL2796의 미국 임상 1상 연구 비임상 연구를 2년간 지원 받을 있다 SKL27969는 전임상 개발 과정을 통해 우수한 약효 임상시험
,,SK CCLG
,,19
,팜이데일리,미래 가치를 읽다대박 날 바이오 다크호스신간
,팜이데일리,책은 이미 다가와 있는 미래를 상상할 있게 해준다 덤으로 얻어지는 투자 정보는 바이오 투자에 접근하기 어려웠던 독자분들에게 도움을 것으로 확신한다사진이데일리황현순 키움증권 대표의 2023 대박 날 바이오 다크호스에 대한 추천사다
2022-10-17,핀포인트뉴스,투자주체 매매동향 외국인투자자 삼성전자SK하이닉스 집중 매수
2022-10-17,핀포인트뉴스,핀포인트뉴스 한강희 기자 17일 한국거래소에 따르면 이날 외국인투자자들은 유가증권시장에서 삼성전자 주식을 집중 매수한 것으로 나타났다외국인투자자들은 이날 삼성전자 주식을 1477억원262만주 집중 매수하면서 순매수 1위를 기록했다뒤를 이어 SK하이닉스 479억원 한국항공우주 255억원을 사들이며 순매수 상위권에 이름을 올렸다반면 카카오 한화에어로스페이스 POSCO홀딩스 등은 처분했다다음은 외국인과 기관 개인투자자들의 시장별 순매수 순매도 상위종목이다외국인 유가증권시장 순매수 상위 종목삼성전자
2022-10-11,,CJ그룹 바이오 계열사 공식 출범업계 경쟁 뜨거워지나
2022-10-11,,더퍼블릭  김강석 기자 CJ그룹이 레드바이오Red Bio 제약헬스케어 전문계열사 CJ바이오사이언스를 출범시켰다 국내 기업들이 앞다퉈 바이오의약품 위탁개발생산CDMO에 뛰어들면서 경쟁이 치열해지는 분위기다11일 제약계에 따르면 최근 CJ제일제당은
,데일리메디,코로나 치료제백신 중단 제약바이오사 정밀 평가
,데일리메디,정부 예산 지원으로 코로나19 백신이나 치료제 개발에 나선 제약사들에 정부가 평가용역을 통해 점검에 들어간다     보건복지부 보건의료기술개발과는 내용의 점검 계획을 보건복지위원회 국정감사 서면답변을 통해 최근 국회에 전달했다     현재까지 정부가 코로나19 백신 치료제 임상지원 사업을 통해 비용을 지원한 기업은 총 14개다 이중 개발중단 기업은 총 4개다     백신은 제넥신 SK바이오사이언스 진원생명과학 셀리드 유바이오로직스 큐라
2022-11-17,이데일리,코스피 마감외국인기관 매도에 14반도체 부진
2022-11-17,이데일리,코스피가 글로벌 경기 둔화 우려에 휩싸이며 하락 마감했다 17일 마켓포인트에 따르면 코스피는 전거래일 대비 3455포인트139 하락한 244290으로 마감했다 이날 코스피는 2460선에서 하락 출발해 내내 낙폭을 키우며 2440선까지 밀렸다 간밤
2022-10-16,핀포인트뉴스,셀트리온SK바사 코로나 치료제백신 개발로 세계 3번째 보유국치료제 개발 진행중
2022-10-16,핀포인트뉴스,핀포인트뉴스 최필승 기자 한국은 셀트리온의 렉키로나와 SK바이오사이언스의 스카이코비원멀티주를 보유하면서 세계 3번째로 코로나19 치료제와 백신을 보유한 국가가 된 가운데 여러 기업들이 아직 개발을 진행중이다16일 식품의약품안전처 임상승인 현황에 따르면 코로나19 치료제로 식약처로부터 임상을 승인받은 국내 기업은 현재까지 25곳으로 셀트리온 부광약품 엔지켐생명과학 신풍제약 종근당 크리스탈지노믹스 대웅제약 제넥신 녹십자 대웅제약 뉴지랩테라퓨틱스 동화약품 이뮨메드 녹십자웰빙 등이 있다또 한국유나이티드
2022-12-09,신아일보,기고 직능별 혁신 신약개발 전문인력 양성 시급
2022-12-09,신아일보,SK바이오팜은 뇌전증 치료 신약 lsquo엑스코프리rsquo의 성공요인으로 명확한 데이터 확보와 유능한 인재 영입을 꼽았다 절대적으로 공감되는 말이면서도 우리나라 제약바이오기업들의 신약개발 수준을 투영해볼 걱정이 앞선다 국내의 일부 신약개발 연구책임자들을 대다수 연구자들의 개발 경험이 일천해 물질의 약효에만 집중하는 경향이기 때문이다 초기 임상시험 설계가 미흡할 임상전담 인력과 조직 턱없이 부족한 현실이다따라서 우리나라의 글로벌 신약 기근 현상을 빨리 탈피하기 위한 선택 집중 1순위를 고
,메트로신문,12월 2일자 메트로 한줄뉴스
,메트로신문,지난달 수출이 크게 감소한 반면 에너지 위주 수입이 급등하며 무역수지 적자가 8개월째 이어졌다 글로벌 경기둔화에다 지난달 화물연대 집단 운송거부 등이 복합 영향을 미쳤다는 분석이다 공정거래위원회가 온라인 플랫폼 관련 이슈에 보다 체계적으
20221012T0,매일신문,2022 경북 바이오생명엑스포 지역특화 바이오한국형 헴프 미래 신성장 동력 키운다
20221012T0,매일신문,경북도와 안동시가 14일부터 16일까지 3일동안 경북도청 동락관과 새마을광장에서 2022 경북 바이오생명엑스포를 개최한다 바이오 산업에서 미래 신성장 동력을 발굴하기 위해서다
,뉴스투데이,N2 모닝 경제 브리핑11월 29일  증시 중국 봉쇄조치에 하락애플마이크로소프트 2대
,뉴스투데이,뉴스투데이황수분 기자  뉴욕 금융시장 요약 뉴욕증권거래소NYSE에서 28일현지시각 다우존스30산업평균지수는 전장보다 49757포인트145 하락한 3384946로 거래를 마쳤다 스탠더드앤드푸어스SP500지수는 거래일보다 6218포인
2022-09-22,아주경제,한중일 바이오 CDMO 시장 다크호스로 급부상시장 판도 바뀌나  아주경제
2022-09-22,아주경제,동아시아 3마리 용으로 불리던 한국 중국 일본의 바이오기업들이 폭발적으로 성장하고 있는 글로벌 CDMO위탁개발생산 시장에서 다크호스로 부상하고 있다바이오의약품 CDMO는 의약품 개발업체로부터 세포주를 받아 의약품을 대량생산하는 위탁생산CMOr
2022-11-17,아시아경제,668조 오일머니 잡아라 직접 세일즈 나선 총수들
2022-11-17,아시아경제,17일 방한한 무함마드 빈 살만 사우디아라비아 왕세자가 국내 재계 총수들과 만나 대규모 사업협력을 논의한다 주요 그룹 총수들은 기회의 땅으로 부각되고 있는 사우디아라비아와의 5000억달러668조원 규모 사업을 위해 직접 세일즈에 나선다  회동을 통해 빈 살만 왕세자가 추진하는 신도시 건설 네옴시티 프로젝트에 대한 투자업무협약MOU과 신사
2022-10-19,핀포인트뉴스,삼성전자 SK하이닉스 LG화학 하락 LG에너지솔루션 삼바 삼성SDI 들썩
2022-10-19,핀포인트뉴스,핀포인트뉴스 이경선 기자 장 초반 강보합세를 보였던 코스피가 달러 강세와 미국 금리 상승의 영향으로 오후 반락하며 장을 마쳤다 외국인들의 나홀로 순매수세가 있었으며 코스닥은 한때 700선에서 거래되기도 했다19일 한국거래소에 따르면 코스피는 거래일224995 대비 1251포인트056 하락한 223744에 장을 닫았다이날 코스피는 060포인트003 내린 224935로 출발했으나 오전 강보합을 기록하며 2560선에서 거래되기도 했다 오후 들어 하락 전환했다하락 전환에 증권가는 달
2022-11-04,핀포인트뉴스,바이오K뉴딜 구성종목 일제히 하락 부진SK바이오사이언스  347
2022-11-04,핀포인트뉴스,핀포인트뉴스 한강희 기자 KRX 바이오 K뉴딜지수 구성종목이 일제히 하락했다 4일 한국거래소에 따르면 지난 3일 KRX 바이오 K뉴딜지수 구성종목 시가총액은 124조7792억원을 기록해 2일 시가총액 126조1234억원과 비교해 1조3441억원 감소한 것으로 나타났다이들 구성 종목 SK바이오사이언스 종목은 347를 기록해 KRX바이오 K뉴딜 종목 가장 부진한 흐름을 나타냈다전날 KRX바이오 K뉴딜지수 구성종목 등락률은 다음과 같다표기순서는 순위 종목명 3일 종가 등락률 순이다1위 삼성바이오로직스
,팜이데일리,알테오젠 쪼개기 상장 갈등 수면위 바이오 기업은
,팜이데일리,바이오 기업 쪼개기 상장을 둘러싼 소액주주와 회사 간 갈등이 수면 위로 올라왔다 파이프라인 쪼개기를 통해 상장을 노리는 바이오 기업 자회사에도 관심이 집중된다 23일 바이오 업계에 따르면 알테오젠196170 소액주주연대는 최근 대전지방법원에 회계장
2022-07-29,,단독 SK그룹 베트남 제약사 이멕스팜 주식 추가 매입지분율 50 돌파
2022-07-29,,더구루오소영 기자 SK그룹이 베트남 5대 제약사 이멕스팜에 추가 투자해 지분률을 50 이상으로 늘렸다 지난 2월 재투자를 5개월 만에 세 번째 투자를 단행했다 빠르게 성장하는 베트남 제약 시장에 선제적인 투자가 필요하다는 판단에 따른 것으로 해석된다 이멕스팜은 지난 26일현지시간 호찌민 증권거래소에 SK그룹의 자회사인 SK인베스
2022-11-02,초이스경제,코스피 간신히 올랐다SK하이닉스  LG전자  SK바이오 상승
2022-11-02,초이스경제,초이스경제 이영란 기자 2일 코스피 지수가 외국인의 순매수에 사흘째 상승하며 강보합세로 마감했다 2일현지시간로 예정된 연준Fed 연방준비제도의 연방공개시장위원회FOMC 정례회의 결과 발표를 앞둔 짙은 관망 속에 극심한 눈치보기 장세가 펼쳐졌다 연준이 오는 12월부터 긴축을 늦출 있을 것이라는 기대감 속에 뉴욕증시 선물이 상승하며 코스피 지수를 지지했다이날 약세로 출발한 지수는 장중 상승과 하락을 반복하다가 장 막판에 간신히 오름세로 가닥을 잡았다 원달러 환율이 1410원 대에서
2022-08-19,핀포인트뉴스,EMA SK바이오사이언스 코로나19 백신 스카이코비온 심사 착수
2022-08-19,핀포인트뉴스,핀포인트뉴스 최필승 기자 유럽의약품청EMA은 SK바이오사이언스의 코로나19 백신 스카이코비원에 대한 심사에 착수했다AFP통신에 따르면 18일현지시간 EMA는 SK바이오사이언스 코로나19 백신의 조건부 승인에 대한 검토를 시작했다고 밝혔다앞서 SK바이오사이언스는 영국에 조건부 허가를 신청했으며 지난 1일 EMA에 허가 신청을 바 있다이에 EMA 산하 약물사용자문위원회CHMP는 스카이코비원이 코로나 초기 바이러스에 대응해 항체를 생성하는지 백신의 안전성과 품질과 관련한 자료를 제출받아 검토한다S
2022-10-05,핀포인트뉴스,네팔 SK바사 GBP510 코로나백신 이종 부스터샷 임상 3상 승인
2022-10-05,핀포인트뉴스,핀포인트뉴스 최필승 기자 SK바이오사이언스의 GBP510 코로나19 백신이 네팔서 이종 부스터샷 임상 3상 시험계획을 승인받았다고 4일 밝혔다네팔 임상 3상은 기존에 허가된 코로나19 백신을 2회 접종한 건강한 성인을 대상으로 GBP510을 3차 접종했을 때의 면역원성과 안전성 등을 평가하기 위함이다토종 코로나19 백신 1호인 SK바이오사이언스의 스카이코비원멀티주가 추가 접종에서 오미크론 변이 바이러스에 효과를 보인 것으로 알려졌다국립보건연구원 국립감염병연구소에 따르면 2일 스카이코비원으로 추가접종 국내에서 유
,메디파나 뉴스,제약공시 책갈피 9월 1주차  LG화학SK바이오사이언스
,메디파나 뉴스,메디파나뉴스  이정수 기자 9월 1주차82992에는 LG화학이 통풍 신약후보물질에 대한 번째 미국 3상 승인을 미국 FDA에 신청했다 연구 범위와 환자를 공격적으로 늘려가고 SK바이오사이언스는 로타바이러스 백신 단독 투여를 위한 3상을 중단했
2022-11-17,팍스넷뉴스,제약 동아ST DMB3115 글로벌 임상 3상 종료   팍스넷뉴스
2022-11-17,팍스넷뉴스,동아ST 스텔라라 바이오시밀러 DMB3115 글로벌 임상 3상 종료 동아에스티는 스텔라라우스테키누맙 바이오시밀러 DMB3115의 글로벌 임상 3상이 종료됐다고 밝혔다 DMB3115의 글로벌 임상 3상은 2021년 미국을 시작으로 폴란드 에스토니아 라트비아 총 9개국에서 차례로 개시돼 총 605명의 환자를 등록했고 52주간 진행됐
2022-11-22,글로벌이코노믹,시가총액 대비 공매도잔고금액 상위 30선17일
2022-11-22,글로벌이코노믹,22일 한국거래소에 따르면 지난 17일 기준 유가증권시장과 코스닥시장에서 시가총액 대비 공매도 잔고금액 비중 상위 종목은 다음과 같다유가증권시장 시가총액 대비 공매도 잔고금액 비중17일1위 롯데관광개발 734억원875 2위 호텔신라 1804억원63 3위 HMM 4936억원491 4위 두산퓨얼셀 1140억원473
2022-09-29,비즈니스워치,제약바이오 스핀오프띠부씰처럼 자회사 뗐다 붙였다
2022-09-29,비즈니스워치,네이버 인터파크 SK엔카 등은 국내 스핀오프spinoffmiddot회사 분할의 효시로 꼽힌다 이들 기업은 대기업의 사내벤처로 출발해 현재 업계를 대표하는 기업으로 성장했다 스핀오프가 대기업의
,µ¥ÀÏ¸®ÆÊ,5  3
,µ¥ÀÏ¸®ÆÊ,3                   50  43      50  29         1    2
2022-10-05,핀포인트뉴스,삼성전자 LG에너지솔루션 SK하이닉스 훨훨 현대차 기아 네이버는 뚝
2022-10-05,핀포인트뉴스,핀포인트뉴스 이경선 기자 코스피가 차익 실현 매물 출회에 026 올라 2210선에서 거래를 마쳤다 코스닥지수는 16 하락해 700선 아래에서 마감했다5일 코스피는 거래일220938보다 584포인트026 오른 221522에 장을 닫았다 지수는 전일보다 179 오른 224885에 출발해 개장 초반 상승폭을 키웠으나 장중 혼조세를 보이다 강보합선에서 거래를 종료했다유가증권시장에서 개인과 외국인은 4541억원 766억원어치를 사들였다 반면 기관은 홀로 5505억원을 매도했다업종별로는 엇
2022-11-17,머니투데이,삼성 46개LG 28개CES 혁신상 싹쓸이한 기업종합  머니투데이
